{
  "$schema": "http://json-schema.org/draft-07/schema#",
  "$id": "https://raw.githubusercontent.com/litentry/vc-jsonschema/main/dist/schemas/1-basic-identity-verification/1-0-0.json",
  "title": "Basic Identity Verification",
  "description": "You've identified at least one account/address in both Web2 and Web3.",
  "type": "object",
  "required": [
    "@context",
    "issuer",
    "issuanceDate",
    "credentialSubject",
    "proof"
  ],
  "properties": {
    "@context": {
      "type": "array",
      "items": {
        "type": "string",
        "format": "uri"
      }
    },
    "id": {
      "type": "string"
    },
    "type": {
      "type": "array",
      "items": {
        "type": "string"
      }
    },
    "issuer": {
      "type": "object",
      "required": [
        "id",
        "name",
        "mrenclave"
      ],
      "properties": {
        "id": {
          "type": "string"
        },
        "name": {
          "type": "string"
        },
        "mrenclave": {
          "type": "string"
        }
      }
    },
    "issuanceDate": {
      "type": "string",
      "format": "date-time"
    },
    "proof": {
      "type": "object",
      "required": [
        "created",
        "type",
        "proofPurpose",
        "proofValue",
        "verificationMethod"
      ],
      "properties": {
        "created": {
          "type": "string",
          "format": "date-time"
        },
        "type": {
          "type": "string"
        },
        "proofPurpose": {
          "type": "string"
        },
        "proofValue": {
          "type": "string"
        },
        "verificationMethod": {
          "type": "string"
        }
      }
    },
    "credentialSubject": {
      "title": "Credential Subject of A1 assertion/ Basic Identity Verification",
      "type": "object",
      "required": [
        "id",
        "type",
        "values",
        "endpoint",
        "assertions"
      ],
      "properties": {
        "id": {
          "type": "string"
        },
        "type": {
          "type": "string"
        },
        "description": {
          "type": "string"
        },
        "values": {
          "type": "array",
          "minItems": 1,
          "items": {
            "type": "boolean"
          }
        },
        "endpoint": {
          "type": "string",
          "format": "uri"
        },
        "assertions": {
          "type": "array",
          "minItems": 1,
          "items": {
            "type": "object",
            "required": [
              "and"
            ],
            "properties": {
              "and": {
                "type": "array",
                "minItems": 2,
                "maxItems": 2,
                "additionalItems": false,
                "items": [
                  {
                    "type": "object",
                    "required": [
                      "src",
                      "op",
                      "dst"
                    ],
                    "properties": {
                      "src": {
                        "type": "string",
                        "enum": [
                          "$has_web2_account"
                        ]
                      },
                      "op": {
                        "type": "string",
                        "enum": [
                          "=="
                        ]
                      },
                      "dst": {
                        "type": "string",
                        "enum": [
                          "true"
                        ]
                      }
                    }
                  },
                  {
                    "type": "object",
                    "required": [
                      "src",
                      "op",
                      "dst"
                    ],
                    "properties": {
                      "src": {
                        "type": "string",
                        "enum": [
                          "$has_web3_account"
                        ]
                      },
                      "op": {
                        "type": "string",
                        "enum": [
                          "=="
                        ]
                      },
                      "dst": {
                        "type": "string",
                        "enum": [
                          "true"
                        ]
                      }
                    }
                  }
                ]
              }
            }
          }
        }
      }
    }
  }
}