{
    "@context":[
        "https://www.w3.org/2018/credentials/v1",
        "https://w3id.org/security/suites/ed25519-2020/v1"
    ],
    "id":"0x7a9e038f30e90e5f5dff366a3a8b98d3797fb9747691571a499dcd78d4a8e014",
    "type":[
        "VerifiableCredential"
    ],
    "credentialSubject":{
        "id":"did:litentry:substrate:0xd43593c715fdd31c61141abd04a99fd6822c8558854ccde39a5684e7a56da27d",
        "description":"You've identified at least one account/address in both Web2 and Web3.",
        "type":"Basic Identity Verification",
        "assertions":[
            {
                "and":[
                    {
                        "src":"$has_web2_account",
                        "op":"==",
                        "dst":"true"
                    },
                    {
                        "src":"$has_web3_account",
                        "op":"==",
                        "dst":"true"
                    }
                ]
            }
        ],
        "values":[
            false
        ],
        "endpoint":"http://localhost:9933"
    },
    "issuer":{
        "id":"did:litentry:substrate:0x28d3b174041231100f3bea49444fb44b5ee500a463b2d26ff7e6dc5d98f15135",
        "name":"Litentry TEE Worker",
        "mrenclave":"6cgJxACaf91s7CvoA6fVYUHpvFKLrEDe3mLJHDND6t59"
    },
    "issuanceDate":"2023-09-26T02:41:54.471751195+00:00",
    "proof":{
        "created":"2023-09-26T02:41:54.472164087+00:00",
        "type":"Ed25519Signature2020",
        "proofPurpose":"assertionMethod",
        "proofValue":"25ff768780046ad249c2d853b9d442850199304221b78f3da99e0aac946a627702927262db5cef1a5411cba82c0925359fd31b0bac1771eb28c71b271bec9f0b",
        "verificationMethod":"28d3b174041231100f3bea49444fb44b5ee500a463b2d26ff7e6dc5d98f15135"
    }
}