{
  "@context": [
    "https://www.w3.org/2018/credentials/v1",
    "https://w3id.org/security/suites/ed25519-2020/v1"
  ],
  "id": "0x0d3f27cf78b7f72f2d9b7dca4727c58043be6d5763a3151f4edaa15b12ca3c90",
  "type": ["VerifiableCredential"],
  "credentialSubject": {
    "id": "did:litentry:substrate:0xd43593c715fdd31c61141abd04a99fd6822c8558854ccde39a5684e7a56da27d",
    "description": "Gets the range of number of transactions a user has made for a specific token on all supported networks (invalid transactions are also counted)",
    "type": "EVM/Substrate Transaction Count",
    "assertions": [
      {
        "and": [
          {
            "src": "$total_txs",
            "op": ">=",
            "dst": "20"
          },
          {
            "src": "$total_txs",
            "op": "<",
            "dst": "50"
          },
          {
            "or": [
              {
                "src": "$network",
                "op": "==",
                "dst": "Polkadot"
              }
            ]
          }
        ]
      }
    ],
    "values": [true],
    "endpoint": "http://localhost:9933"
  },
  "issuer": {
    "id": "did:litentry:substrate:0x28d3b174041231100f3bea49444fb44b5ee500a463b2d26ff7e6dc5d98f15135",
    "name": "Litentry TEE Worker",
    "mrenclave": "6cgJxACaf91s7CvoA6fVYUHpvFKLrEDe3mLJHDND6t59",
    "runtimeVersion": {
      "parachain": 9174,
      "sidechain": 104
    }
  },
  "issuanceDate": "2023-09-26T02:50:42.312362493+00:00",
  "proof": {
    "created": "2023-09-26T02:50:42.312641669+00:00",
    "type": "Ed25519Signature2020",
    "proofPurpose": "assertionMethod",
    "proofValue": "25ff768780046ad249c2d853b9d442850199304221b78f3da99e0aac946a627702927262db5cef1a5411cba82c0925359fd31b0bac1771eb28c71b271bec9f0b",
    "verificationMethod": "28d3b174041231100f3bea49444fb44b5ee500a463b2d26ff7e6dc5d98f15135"
  }
}
