{
    "@context":[
        "https://www.w3.org/2018/credentials/v1",
        "https://w3id.org/security/suites/ed25519-2020/v1"
    ],
    "id":"0xcb4236039f53af617430c633b632c91f3d8994c4a8d2204aa92ed832e63685d5",
    "type":[
        "VerifiableCredential"
    ],
    "credentialSubject":{
        "id":"did:litentry:substrate:0xd43593c715fdd31c61141abd04a99fd6822c8558854ccde39a5684e7a56da27d",
        "description":"The length of time a user continues to hold a particular token (with particular threshold of token amount)",
        "type":"ETH Holding Time",
        "assertions":[
            {
                "and":[
                    {
                        "src":"$minimum_amount",
                        "op":"==",
                        "dst":"10"
                    },
                    {
                        "src":"$from_date",
                        "op":"<",
                        "dst":"2017-01-01"
                    },
                    {
                        "src":"$to_date",
                        "op":">=",
                        "dst":"2023-09-26"
                    }
                ]
            }
        ],
        "values":[
            false
        ],
        "endpoint":"http://localhost:9933"
    },
    "issuer":{
        "id":"did:litentry:substrate:0x28d3b174041231100f3bea49444fb44b5ee500a463b2d26ff7e6dc5d98f15135",
        "name":"Litentry TEE Worker",
        "mrenclave":"6cgJxACaf91s7CvoA6fVYUHpvFKLrEDe3mLJHDND6t59"
    },
    "issuanceDate":"2023-09-26T03:48:00.456139284+00:00",
    "proof":{
        "created":"2023-09-26T03:48:00.456425831+00:00",
        "type":"Ed25519Signature2020",
        "proofPurpose":"assertionMethod",
        "proofValue":"25ff768780046ad249c2d853b9d442850199304221b78f3da99e0aac946a627702927262db5cef1a5411cba82c0925359fd31b0bac1771eb28c71b271bec9f0b",
        "verificationMethod":"28d3b174041231100f3bea49444fb44b5ee500a463b2d26ff7e6dc5d98f15135"
    }
}