{
    "@context":[
        "https://www.w3.org/2018/credentials/v1",
        "https://w3id.org/security/suites/ed25519-2020/v1"
    ],
    "id":"0xf4787b47819a21b475aa0e46b2bf1d2f4f1adda28de6a37d47acc584e4632754",
    "type":[
        "VerifiableCredential"
    ],
    "credentialSubject":{
        "id":"d43593c715fdd31c61141abd04a99fd6822c8558854ccde39a5684e7a56da27d",
        "description":"The class of year that the user account was created on a particular network (must have on-chain records)",
        "type":"Account Class Of Year",
        "assertions":[
            {
                "and":[
                    {
                        "src":"$account_created_year",
                        "op":"==",
                        "dst":"Invalid"
                    }
                ]
            }
        ],
        "values":[
            false
        ],
        "endpoint":"http://localhost:9933"
    },
    "issuer":{
        "id":"3730028d06f5cad69891d61a198a7b4495ff5fbaf6203df6b12fbf37e5336952",
        "name":"Litentry TEE Worker",
        "mrenclave":"ELzBHDP2T1TfYpD3ES3zBeRN43X9AmUC2cFqtckbynTP"
    },
    "issuanceDate":"2023-08-05T10:20:12.355000681+00:00",
    "proof":{
        "created":"2023-08-05T10:20:12.356444202+00:00",
        "type":"Ed25519Signature2020",
        "proofPurpose":"assertionMethod",
        "proofValue":"666a2d3c8163019fe9e2de38c40896e3a4e1eada0cc1d4e335c1877e497557a1b3cadc9282b1b9cacaec949ee13191cd386a97f7b0f4c14201a87a01c8621402",
        "verificationMethod":"3730028d06f5cad69891d61a198a7b4495ff5fbaf6203df6b12fbf37e5336952"
    }
}