{
    "@context":[
        "https://www.w3.org/2018/credentials/v1",
        "https://w3id.org/security/suites/ed25519-2020/v1"
    ],
    "id":"0x8798dbc0a812d235f7d136e599dd33fda6cee0f6d3b2c66f8093a5c2ddd41bf0",
    "type":[
        "VerifiableCredential"
    ],
    "credentialSubject":{
        "id":"did:litentry:substrate:0xd43593c715fdd31c61141abd04a99fd6822c8558854ccde39a5684e7a56da27d",
        "description":"You have commented in Litentry Discord #ðŸª‚id-hubber channel. Channel link: https://discord.com/channels/807161594245152800/1093886939746291882",
        "type":"Active Discord ID-Hubber",
        "assertions":[
            {
                "and":[
                    {
                        "src":"$has_role",
                        "op":"==",
                        "dst":"true"
                    },
                    {
                        "src":"$has_commented",
                        "op":"==",
                        "dst":"true"
                    },
                    {
                        "src":"$discord_guild_id",
                        "op":"==",
                        "dst":"10"
                    },
                    {
                        "src":"$discord_channel_id",
                        "op":"==",
                        "dst":"10"
                    },
                    {
                        "src":"$discord_role_id",
                        "op":"==",
                        "dst":"10"
                    }
                ]
            }
        ],
        "values":[
            false
        ],
        "endpoint":"http://localhost:9933"
    },
    "issuer":{
        "id":"did:litentry:substrate:0x28d3b174041231100f3bea49444fb44b5ee500a463b2d26ff7e6dc5d98f15135",
        "name":"Litentry TEE Worker",
        "mrenclave":"6cgJxACaf91s7CvoA6fVYUHpvFKLrEDe3mLJHDND6t59"
    },
    "issuanceDate":"2023-09-26T02:45:42.341318167+00:00",
    "proof":{
        "created":"2023-09-26T02:45:42.341636083+00:00",
        "type":"Ed25519Signature2020",
        "proofPurpose":"assertionMethod",
        "proofValue":"25ff768780046ad249c2d853b9d442850199304221b78f3da99e0aac946a627702927262db5cef1a5411cba82c0925359fd31b0bac1771eb28c71b271bec9f0b",
        "verificationMethod":"28d3b174041231100f3bea49444fb44b5ee500a463b2d26ff7e6dc5d98f15135"
    }
}